{
  "topic": "美国中期选举与全球资产",
  "category": "宏观与资产",
  "tags": [
    "中期选举",
    "民调口径",
    "财政与关税",
    "期限溢价",
    "黄金与石油",
    "A股港股",
    "数字货币"
  ],
  "aliases": [
    "中期选举",
    "midterms",
    "美国国会",
    "参议院",
    "众议院",
    "共和党",
    "民主党",
    "filibuster",
    "预算调和",
    "reconciliation",
    "政府关门",
    "财政停摆",
    "关税",
    "联储独立性",
    "期限溢价",
    "黄金",
    "WTI",
    "布伦特",
    "比特币",
    "稳定币",
    "北向资金",
    "南向资金"
  ],
  "subtitle": "不猜谁赢：把两党的牌分成制度牌与议程牌，再把资产写成一条一条能观察的传导链",
  "reader": "想在选举年里不被「谁当选就买什么」这类话带着走的读者",
  "theme": {
    "token": "ballot-navy",
    "hero_motif": "majority_line",
    "hero_note": "全篇的记忆点：一排席位格，中间那道线是多数门槛——它比任何一格的颜色都重要，因为资产关心的从来不是谁票多，而是**哪一院跨过那条线、跨过多格**。格子上不标任何席位数字（R-02）：席位是随时点变化的量化断言，已经带来源地活在正文里。两色分列两侧，不写哪边是执政党，避免把颜色读成倾向。"
  },
  "reading_target_minutes": 14,
  "slug": "us-midterms-and-assets",
  "image_exclude_pages": [
    "https://touch.travel.qunar.com/",
    "https://travel.qunar.com/",
    "https://i.qunar.com/",
    "https://detail.1688.com/"
  ],
  "sections": [
    {
      "id": "what-polls-say",
      "title": "民调能说的只有一件事：现在谁在通用 ballot 上领先，以及怎么量的",
      "anchor": "调",
      "angle": "本篇**不预测选举结果**，所以民调只能作为「当前读数」出现，且必须交代口径：①generic ballot（全国政党偏好）与众院实际席位是两个东西，选区地图让前者到后者的转换高度非线性；②抽样框（注册选民 vs  likely voters）、时间窗、样本量与误差幅度，缺一项的引用都不算数；③不同机构的方法差异本身就是内容——哪些模型用党派身份回归、哪些用登记数据，会让同一时期出现不同方向的「领先」；④中期选举的历史基线：执政党几乎总是失去众院席位，这一条比任何当期民调都更稳定，要给出历史数据与来源。收尾给一句纪律：**读数不是预测，「领先 3 个点」在误差范围内就是「没有差别」**。全程不写「谁会赢」。",
      "block_types": [
        "prose",
        "keyvalue_table",
        "note",
        "fact_strip"
      ],
      "image_queries": [
        "投票站 排队 美国",
        "竞选 集会 现场"
      ],
      "fact_prompts": [
        "当前主流通用 ballot 民调的读数：机构、抽样框、时间窗、样本量、误差幅度（逐条给来源与日期）",
        "不同机构方法差异的公开说明（如是否用 likely voters、是否做党派回归），给来源",
        "中期选举执政党众院席位变动的历史序列（至少近 20 届），来源给官方或权威统计",
        "当前国会两院席位结构与改选席位数量（官方数据）"
      ]
    },
    {
      "id": "map-and-structure",
      "title": "决定结果的不是情绪，是地图、改选名单和投票规则",
      "anchor": "图",
      "angle": "把「为什么通用 ballot 领先却未必翻盘」讲清楚，三件结构性的事：①选区划分与重新划分（redistricting）的周期与诉讼状态，哪些州在选举前还有法院裁决未定；②参议院的改选结构是每六年轮一次，某一届的「防守名单」长短是先天决定的，与当期人气关系较小；③州级投票规则（邮寄、提前投票、选区重划委员会、选民 ID）由州议会与州长定，它们改变的是**谁来投**，不是谁被投给。所有条目要落到「哪个州、什么规则、什么时候生效、来源」，不写「某党有优势」这类无口径判断。",
      "block_types": [
        "prose",
        "compare",
        "card_grid",
        "note"
      ],
      "image_queries": [
        "选区 地图 划分",
        "州议会 大厦 外观"
      ],
      "fact_prompts": [
        "本轮周期内各州选区重划的当前状态与未决诉讼（给官方或权威法律数据库来源）",
        "本次改选的参议院席位按党归属分布（官方数据）",
        "近两年通过或修改的州级投票规则清单（生效日期、州、内容），给来源",
        "提前投票与邮寄选票在主要州的占比历史数据，给来源"
      ]
    },
    {
      "id": "republican-cards",
      "title": "共和党的牌，一半是规则给的，一半是议程要的",
      "anchor": "和",
      "angle": "写法纪律：**只描述制度与政策工具本身，不评价好坏、不写「哪一党更好」**（红线 R-09）。把牌分成两栏：①**制度性牌**——参院多数与委员会主席、预算调和（reconciliation，一年几次、能绕开什么规则、有什么边界）、行政令与机构解释空间、法院任命与既有判例的约束、州层级的选举规则与重划权、联邦机构的人事与执法优先级。每条要写清**能单独做到什么、什么时候失效**（比如调和受 Byrd 规则类约束、行政令可被下一任撤销、诉讼可暂时冻结）。②**议程性牌**——关税与贸易工具、减税与税制、移民执法、能源与监管放松、产业补贴的存废。每条注明它需要国会、还是需要行政、还是需要两者配合。不预测这些会不会发生。",
      "block_types": [
        "compare",
        "card_grid",
        "prose",
        "note"
      ],
      "image_queries": [
        "美国国会大厦 参议院",
        "白宫 总统令 签署"
      ],
      "fact_prompts": [
        "预算调和程序的定义、使用频率限制与可覆盖的议题范围（来源给国会研究服务或权威制度说明）",
        "行政令的法律边界：可被撤销、可被法院冻结的公开判例或机制说明",
        "当前关税法律工具的授权来源与限制（如 1974/1962 年相关条款的公开说明）",
        "共和党公开的政策主张清单（来源给党纲或公开声明原文，只引述不作评价）"
      ]
    },
    {
      "id": "democrat-cards",
      "title": "民主党的牌：少数党能做什么，以及哪些要等 2028",
      "anchor": "民",
      "angle": "同样两栏、同样纪律（不评价、不预测）。①**制度性牌**——众院少数党的调查与传票权、听证与文件公开、州长与州总检察长的诉讼能力（含跨州联合起诉）、阻挠议事在参院的实际门槛、州级选区重划与投票规则扩张、地方检察官与州法执行差异。要点出**这些牌的作用半径**：多数是「提高成本、延缓执行、留下记录」，而不是「阻止」。②**议程性牌**——医保补贴与药价、通胀与生活成本、社保与医保的信托基金时钟、投票权立法、税收公平。要老实区分哪些议题在中期选民中真正驱动投票（有出口民调与学术研究的公开证据），哪些只是捐款与媒体议程。不写「哪张牌更有效」的倾向性结论。",
      "block_types": [
        "compare",
        "card_grid",
        "prose",
        "note"
      ],
      "image_queries": [
        "国会 听证会 现场",
        "州总检察长 办公 大楼"
      ],
      "fact_prompts": [
        "众议院调查与传票权的规则说明（来源给国会规则或权威解释）",
        "州总检察长联合诉讼的公开案例数量与结果分布（给来源）",
        "阻挠议事在参院的实际门槛与「核选项」历史（权威制度说明）",
        "出口民调中「最关心议题」的历史排序（近几届中期选举），给来源",
        "社保/医保信托基金公开报告的时钟与假设"
      ]
    },
    {
      "id": "institutions-vs-agenda",
      "title": "为什么要分两栏：可撤销性、时间滞后和成本完全不同",
      "anchor": "撤",
      "angle": "这一章是全篇的方法，必须讲透三件事：①**可撤销性**——行政令与机构解释可被下一任撤销，立法与法院判例的存续期长得多，预算调和通过的税法条款常带日落条款；把一次选举结果当成「政策 10 年不变」是常见的读法错误。②**时间滞后**——从宣布到生效要过规则制定程序（评论期）、诉讼、执行能力建设，市场常在第一个交易日就把终局定价完，这是错的最常见方式。③**成本与传导路径**——同一目标走关税、走补贴、走监管，落在通胀、赤字、汇率上的形态不一样。给一张「工具 × 生效速度 × 可撤销性 × 主要落在哪个宏观变量」的表，逐格标注依据来自哪类公开材料。",
      "block_types": [
        "keyvalue_table",
        "prose",
        "steps",
        "note"
      ],
      "image_queries": [
        "联邦公报 规则 制定",
        "法院 文件 递交"
      ],
      "fact_prompts": [
        "美国规则制定程序（公告—评论—最终规则）的法定时间要求，来源给官方说明",
        "近年通过的重大税法条款中的日落条款实例（来源给立法文本或权威解读）",
        "行政令被后续撤销的公开历史实例",
        "关税工具从宣布到生效的典型时间间隔实例（给来源）"
      ]
    },
    {
      "id": "transmission-channels",
      "title": "先讲链条，再讲资产：财政、关税、利率预期、美元、风险溢价",
      "anchor": "链",
      "angle": "后面几章共用一张「传导图」，所以这一章只讲机制，不讲任何具体资产会涨会跌。五条链条：①**财政链条**：赤字与发债规模 → 期限溢价与长端利率 → 所有资产的贴现率；②**关税链条**：进口价格 → 核心通胀与预期 → 政策利率路径 → 美元与实际利率；③**制度可信度链条**：对央行独立性、债务上限、政府停摆的担忧 → 期限溢价、美元信用、黄金的边际定价；④**增长链条**：政策不确定性 → 企业资本开支与招聘 → 盈利预期；⑤**流动性链条**：财政部发债节奏与 TGA、准备金水平 → 短端资金面 → 风险资产与加密的 beta。每条要写清「用什么公开数据能观察到它动了」（具体指标名与发布方，不给阈值判断）。",
      "block_types": [
        "steps",
        "prose",
        "compare",
        "note"
      ],
      "image_queries": [
        "交易 显示屏 债券",
        "美联储 总部 建筑"
      ],
      "fact_prompts": [
        "期限溢价的公开测算指标名称与发布方（如 ACMS、GK 模型类），来源给官方或研究页",
        "财政发债计划、TGA 与准备金的公开数据源名称",
        "关税对进口价格传导的公开研究估计（给来源与结论口径，不作预测）",
        "政策不确定性指数的公开定义与数据源"
      ]
    },
    {
      "id": "us-stocks-treasuries",
      "title": "美股与美债：把「选后行情」拆成盈利修正和倍数变化",
      "anchor": "债",
      "angle": "**不给任何标的买卖建议、不给目标价**。这一章只做两件事：①给读数方法——价格变化 = 盈利预期变化 × 估值倍数变化，选举年常见误读是把倍数压缩当成「经济变差」；②给历史同类事件的**口径**而非结论：2016 年选后的再通胀交易、2018–2019 贸易摩擦期的行业分化、2022–2024 期限溢价抬升与股票贴现率的联动、政府停摆与债务上限事件的历史市场反应（多数是短期且可逆的，给数据与来源）。还要写清哪些板块对关税、财政、利率各自敏感（用公开的行业收入结构口径，不写「该买哪个」）。收尾一句：选举本身对长期回报的解释力很弱，**政策落地时点与企业盈利周期才是可观测的量**。",
      "block_types": [
        "prose",
        "keyvalue_table",
        "timeline",
        "note"
      ],
      "image_queries": [
        "纽约证券交易所 交易大厅",
        "股票 行情 屏幕"
      ],
      "fact_prompts": [
        "历史美国大选/中期选举前后美股与美债收益的公开研究（给来源与样本区间，不作预测）",
        "政府停摆与债务上限事件的历史市场反应研究或数据（给来源）",
        "当前期限溢价与长端利率的公开数据读数与发布方",
        "标普各行业海外收入与进口依赖的公开结构数据（用于说明敏感度差异）"
      ]
    },
    {
      "id": "china-assets",
      "title": "A股与港股：外资风险偏好、汇率、和两条不同的资金通道",
      "anchor": "港",
      "angle": "边界最紧的一章之一：**只报已公布的规则与其生效时间，不做地缘政治推断，不评价任何一方的制度**。要讲清三件结构：①A股与港股的定价资金不同——港股是离岸美元流动性 + 南向资金，A股以境内资金为主，因此「美国选举」对两者的传导路径不一样（前者走汇率与风险偏好，后者更多走出口链预期）；②可观察的通道指标：北向/南向资金流量统计口径（发布方、更新频率、口径变更历史）、人民币中间价与离岸价差、港股通标的调整；③政策对冲工具箱里已公布的部分（降准降息、财政专项、资本市场制度安排），只列已公布内容与生效时间。历史部分只给可核的同类事件读数（如贸易摩擦期出口链与内需链的分化），并注明「历史不代表未来」是口径声明而非套话——因为样本期的利率环境完全不同。",
      "block_types": [
        "prose",
        "compare",
        "keyvalue_table",
        "note"
      ],
      "image_queries": [
        "上海证券交易所 大厅",
        "香港 中环 金融 大楼"
      ],
      "fact_prompts": [
        "北向/南向资金统计的口径、发布方与近年口径变更（给官方来源）",
        "离岸人民币与中间价价差的公开数据源",
        "近年已公布的资本市场与货币政策工具清单（含生效时间），来源给官方公告",
        "贸易摩擦期中国资产行业分化的公开研究或数据（给来源，不作外推）"
      ]
    },
    {
      "id": "gold-oil-crypto",
      "title": "黄金、石油、数字货币：三种完全不同的定价锚",
      "anchor": "锚",
      "angle": "把三类资产各自「真正在定价的东西」说清，并逐条戳掉选举年常见的口号。①**黄金**：主要锚是实际利率与央行购金，两者都有公开数据（实际利率看 TIPS 隐含、购金看官方储备与央行申报）；「避险所以涨」在历史上并不稳定，要给反例区间与来源。②**石油**：选举几乎不改变供给曲线，真正动的是 OPEC+ 产量决定、页岩资本开支纪律与需求预期（中国增速、全球制造业 PMI）；写清哪些是公开可核的。③**数字货币**：对美国的制度变量敏感（ETF 审批与费用、稳定币立法进程、税收处理口径、清算与托管规则），对「选举结果」本身的关系多是通过流动性与风险偏好间接传导；**不提供任何操作路径、不评价任何币种的安全性、不给方向**。三类都要给「用什么数据观察链条在动」。",
      "block_types": [
        "compare",
        "card_grid",
        "prose",
        "note"
      ],
      "image_queries": [
        "金条 黄金 储备",
        "炼油厂 储油 罐区",
        "比特币 挖矿 矿机"
      ],
      "fact_prompts": [
        "央行购金的官方数据来源与最近可核读数（给来源与日期）",
        "TIPS 隐含实际利率的公开数据源与近期读数",
        "OPEC+ 产量决定的公开公告与生效时间；页岩资本开支的公开统计口径",
        "美国数字货币相关立法与监管动作的已公布内容、时间线与生效状态（只报事实）",
        "历史上「选举年黄金表现」与「避险叙事」不符的可核区间（给数据与来源）"
      ]
    },
    {
      "id": "scenarios-not-odds",
      "title": "情景表，不是概率表：三种结果 × 五类资产的机制格",
      "anchor": "景",
      "angle": "这一章直接回答「不同选举结果会怎么影响资产」，但**只填机制，不填概率、不填方向**。三种结果：执政党守住两院 / 失去一院 / 两院易手。五类资产：美债与美元、美股（分行业敏感度）、A股、港股、黄金石油数字货币。每一格只允许写两样东西：①通过哪条链条（财政/关税/利率预期/美元/风险溢价/流动性）；②要观察到什么数据才算这条链真的动了（指标名 + 发布方 + 频率）。明确写出为什么不给概率：概率要么来自不可核的模型，要么是把民调当预测。并给一条反直觉的读法：**「僵府」（divided government）在财政与关税上的不确定性更低，但在监管与税制上更难改变**——这一格要落在可核的历史财政数据上，不落在评论上。",
      "block_types": [
        "keyvalue_table",
        "compare",
        "prose",
        "note"
      ],
      "image_queries": [
        "会议 白板 情景 规划",
        "数据 终端 多屏"
      ],
      "fact_prompts": [
        "历史上分裂政府与统一政府时期的赤字/发债数据对比（给官方来源）",
        "关税与贸易政策工具在两院不同归属下的实际使用记录（给来源）",
        "各类资产对政策事件敏感度的公开研究（给来源与方法）"
      ]
    },
    {
      "id": "what-would-falsify",
      "title": "什么数据一出现，本篇的机制就该被改写",
      "anchor": "伪",
      "angle": "收尾给一份可证伪清单，把全篇从「分析」变成「可以被打脸的判断」。至少五条，每条写成「如果 X 指标在 Y 口径下持续 Z，则本篇关于链条的叙述不成立」的形式，例如：期限溢价与赤字同时回落（说明财政链条没在定价）、关税传导到核心通胀的弹性显著低于公开研究区间、南向资金与港股相关性结构改变、央行购金停止且实际利率上行而黄金同涨（说明锚不是实际利率）、政策不确定性上升而资本开支同步上升（说明增长链条断了）。最后一段讲方法论：**选举年资产叙事的最大问题不是错，是不可证伪**——它总能找到解释。本篇刻意把每一条判断绑到一个能查的数上，读者不必同意我的链条，但可以查它有没有动。全程不给方向、不给买卖建议。",
      "block_types": [
        "steps",
        "prose",
        "fact_strip"
      ],
      "image_queries": [
        "实验 记录 数据 表格",
        "统计 报表 分析 桌面"
      ],
      "fact_prompts": [
        "上述各指标的可公开获取来源与更新频率（期限溢价、核心通胀细分、资金流、央行储备、资本开支）",
        "关税传导弹性的公开研究估计区间（给来源）",
        "关于政策不确定性与企业投资的公开研究结论（给来源，不作外推）"
      ]
    }
  ]
}