{
  "topic": "Jev",
  "slug": "jev",
  "category": "人工智能",
  "tags": [
    "Jev",
    "TypeSafe",
    "System One",
    "非生成模型",
    "Agent 决策",
    "校准度",
    "延迟",
    "量化"
  ],
  "aliases": [
    "Jev",
    "TypeSafe",
    "TypeSafe AI",
    "System One",
    "System 1",
    "Diogo Almeida",
    "LangChain",
    "Noul",
    "TypeSafeClassifier",
    "卡尼曼",
    "Kahneman"
  ],
  "subtitle": "一个不写字的模型凭什么刷屏：它能替你的 agent 挑选项，但挑得对不对是另一件事",
  "reader": "已经在用 agent、被「0.1 秒、零幻觉、快 200 倍」这些数字刷屏，想知道该把哪一段流程交给它、又该拿什么去验的人",
  "theme": {
    "token": "jev-choice",
    "hero_motif": "choice_bars",
    "hero_note": "母题是「封闭选项上的概率条」：一组等高候选里只有一条被点亮，旁边标着置信度。这就是 Jev 与自回归模型最直观的分界——它的输出空间是人给定的那几个选项，不是开放词表。琥珀色点亮、其余压暗，配深墨底。"
  },
  "reading_target_minutes": 12,
  "sections": [
    {
      "id": "what-happened",
      "title": "先只讲查得到的事实：谁、什么时候、发布了什么",
      "anchor": "实",
      "angle": "把「刷屏」还原成几条可核对的事实：发布方是哪家公司、什么时候从隐身出来、拿了多少钱、模型叫什么、官方给它归的类叫什么、名字从哪来（卡尼曼的系统 1）。创始人背景只写公开自述与媒体转述，并标明是本人说法。这一章不许出现任何性能数字——性能留给后面单独讲口径的章节。",
      "block_types": [
        "prose",
        "keyvalue_table",
        "note"
      ],
      "image_queries": [
        "TypeSafe 官方博客 Jev 发布页截图",
        "旧金山 创业公司 办公室 外景",
        "丹尼尔·卡尼曼 思考快与慢 书封"
      ],
      "fact_prompts": [
        "TypeSafe 公司：注册地、成立时间、何时公开（出隐身）、种子轮金额与投资方，逐项给来源与日期",
        "创始人 Diogo Almeida 的公开履历：他在 OpenAI 参与过什么、这些说法出自他本人还是第三方报道",
        "Jev 与 System One 第一次对外发布的日期与场合，官方博客原文标题",
        "「System One」这个名字的出处，官方是否明引卡尼曼《思考，快与慢》"
      ]
    },
    {
      "id": "not-generating",
      "title": "它和普通大模型差在哪一步：不预测下一个字，而是给你列好的选项打分",
      "anchor": "构",
      "angle": "差异不在大小、快慢，在接口形状：自回归模型吃 prompt 吐 token 流，Jev 吃结构化 state 加一组预设问题、吐每个答案的概率与置信度。把这件事的后果讲全：输出被选项集合封住，所以格式不会错；也正因为封住，它说不出选项之外的话，给不出你没让它考虑的可能性。用一张对照表把「输入 / 输出 / 失败模式 / 可解释性」四行摆平。",
      "block_types": [
        "prose",
        "compare",
        "keyvalue_table"
      ],
      "image_queries": [
        "分类器 输出 概率分布 示意图",
        "softmax 概率条 可视化",
        "agent 工作流 决策节点 示意图"
      ],
      "fact_prompts": [
        "官方对 System One / Jev 的定义原文：输入什么、输出什么、支持哪几类问题（Noul 是不是 / Choice 挑选项 / Score 打分）",
        "自回归语言模型的输出机制（逐 token 采样）的权威描述来源",
        "官方声称「零幻觉 / 0% 类型错误」的确切措辞，以及它成立的前提条件（答案被限制在给定选项内）",
        "Jev 是否有任何形式的文本或理由输出，官方与第三方分别怎么说"
      ]
    },
    {
      "id": "where-it-fits",
      "title": "它站在流程的哪一格：agent 的护栏、路由与分诊台",
      "anchor": "位",
      "angle": "生态位比性能更能说明它是什么：第三方目前把它当决策/分类层用，不是当对话模型。逐个讲清接入形状——工具执行前拦一道、按难易路由到不同模型、进线分类与分诊。每一处都要说「这里省的是什么钱」：省的是把整段上下文喂给大模型的钱与延迟，不是省了人。如果找到成体系的用例清单（如播客/长文的 Top N places to use Jev），按来源列出，并标出哪些是厂商示例、哪些是第三方自己跑的。",
      "block_types": [
        "prose",
        "card_grid",
        "timeline"
      ],
      "image_queries": [
        "LangChain 文档 集成 页面截图",
        "客服工单 分诊 流程图",
        "浏览器 agent 界面 截图"
      ],
      "fact_prompts": [
        "LangChain 侧的接入方式（TypeSafeClassifier、中间件）：官方文档或博客原文，写明是第三方工程集成",
        "第三方公开的用例清单：逐条列出场景，并区分厂商示例与第三方实测",
        "每个用例里被替代的环节是什么（原本用大模型做判断、用规则引擎、用人审），给出来源",
        "有没有已知的生产环境采用案例（公司名、场景、规模），没有就明写没有"
      ]
    },
    {
      "id": "how-to-judge",
      "title": "怎么判断它挑得对不对：格式合法不等于判断正确",
      "anchor": "验",
      "angle": "全篇最要紧的一章，因为刷屏数字几乎全是「不会错」这一类保证，而读者真正要问的是「会不会选错」。给出可操作的判法：一，拿自己带标注的题集测，不看准确率单点、看阈值—覆盖率曲线（愿意放弃多少比例的题去换多少正确率）；二，看校准度而不是只看第一直觉对不对——置信度 0.9 的那批里实际命中多少；三，Score 类输出只能过阈值或排序，不能当量级用；四，算总账：省下的 token 钱与延迟，加上重试、人审、错判代价之后的每单总成本。明确写出目前公开材料的缺口：第三方独立跑分与对照实验的情况。",
      "block_types": [
        "prose",
        "steps",
        "note",
        "keyvalue_table"
      ],
      "image_queries": [
        "可靠性图 reliability diagram 校准",
        "PR 曲线 阈值 覆盖率 图",
        "混淆矩阵 热力图"
      ],
      "fact_prompts": [
        "评测一个封闭选项分类器的标准指标：准确率、校准度（ECE/Brier）、阈值—覆盖率曲线、AUC，各引一份权威教材或论文",
        "「置信度 0.9 的样本里实际命中约 90%」这类校准陈述的可检验定义，给来源",
        "截至发稿有没有公开的第三方 benchmark 或对照实验报告：有则列数字与出处，没有则明写没有",
        "第三方实测类报道（如 36氪「实测Jev」一类）具体测了什么、结论是什么、方法是否可复现",
        "官方给出的任何准确率类数字：口径、任务集、是否可复算，逐项标注为厂商自述"
      ]
    },
    {
      "id": "quant-feasible",
      "title": "拿它做量化决策：哪一段真用得上，哪一段是想象",
      "anchor": "量",
      "angle": "这一章只讲机制与边界，不给任何投资建议、不预测涨跌、不评任何标的或平台。要拆开的是一句流行的类比：把「快」直接当成「能赚钱」。分层讲：延迟敏感的是执行与风控闸门这一段（下单前拦截、异常行情下的降级、仓位约束校验），这一段确实吃毫秒；而「该不该买」是研究判断，靠的是数据、假设与回测，一个只在你给定的选项里挑的模型不会替你产生假设。把讨论落到可核验的观察条件上（例如：是否出现持牌机构公开披露把它用于实盘风控、是否有第三方在带时间戳的实盘/仿真日志上复算过延迟与错判率），而不是「会不会成为新范式」这种问不出结果的话。明确写清错判成本不对称：分类错一次的钱可能远大于省下的推理费。",
      "block_types": [
        "prose",
        "compare",
        "note"
      ],
      "image_queries": [
        "交易所 撮合 机房 光纤",
        "量化 交易 风控 仪表盘",
        "高频交易 时间戳 日志 示意图"
      ],
      "fact_prompts": [
        "把 Jev 与高频交易/快速决策类比的文章具体怎么说（如「像 Flash Boy 一样扣动扳机」一类），列出作者论点与其依据",
        "金融交易链路里各环节的时延量级（行情接收、风控校验、下单撮合）的公开资料与来源",
        "金融机构在 AI 风控/合规上已有的公开监管要求或行业指引（哪些环节允许模型自动决策、哪些要求人审留痕）",
        "有没有任何持牌机构公开披露把 Jev 或同类非生成决策模型用于实盘：有则给出处，没有则明写没有",
        "错判成本不对称的公开讨论：把分类错误换算成损失的口径来自哪里"
      ]
    },
    {
      "id": "why-no-followers",
      "title": "为什么八天里没有同类涌现：门槛到底在哪",
      "anchor": "门",
      "angle": "回答「如果它是新架构方向，为什么没看到别人跟进」。把「架构」这个词拆开看：真正新的可能不是网络结构，而是任务收窄（只做封闭选项判断）+ 输出契约（锁在选项内）+ 部署形态（小、快、便宜）。这三件事里最难复制的是评测与数据生态，不是层数。同时给出反证视角：小参数模型做分类、规则引擎、传统 ML 分类器早就占据这个生态位，Jev 的差异化必须跟这些比，而不是只跟前沿大模型比。时间尺度也要说清：发布到今天只有约一周多，「没有同类」在这个长度上不构成任何证据。",
      "block_types": [
        "prose",
        "keyvalue_table",
        "note"
      ],
      "image_queries": [
        "小型 分类模型 部署 边缘设备",
        "BERT 微调 文本分类 架构图",
        "模型 推理服务 GPU 机柜"
      ],
      "fact_prompts": [
        "发布后一周内是否有其他实验室或公司公开发布同形态（非生成、封闭选项决策）模型：逐个列名字、日期、出处；没有就明写没有",
        "Jev 是否公开了架构细节、参数量、训练方法或论文：官方与第三方各自披露到什么程度",
        "用小模型或传统分类器做同类任务的既有公开实践（文本分类、意图路由、异常闸门），给来源",
        "第三方对「这是不是新范式」的正反观点，逐条注明出处与作者立场"
      ]
    },
    {
      "id": "three-routes",
      "title": "三条路线在争什么：更大更会写、开源快速追、不写只做判断",
      "anchor": "路",
      "angle": "把 Jev 放回地图：一条是自回归继续 scaling（前沿闭源模型），一条是开源与蒸馏 MoE 把成本打下来，一条是 Jev 这种干脆放弃生成、只做快速判断。三条争的不是谁更强，而是「智能该以什么接口交付」——交付一段文字、交付一个可微调的权重、还是交付一次可嵌入流程的判断。每条路线的软肋各写一条可核对的事实，不做优劣裁决。",
      "block_types": [
        "prose",
        "compare",
        "card_grid"
      ],
      "image_queries": [
        "数据中心 AI 训练 集群",
        "开源模型 权重 下载 页面",
        "芯片 晶圆 测试"
      ],
      "fact_prompts": [
        "三条路线各自最新可核对的公开事实（发布、开源、价格、性能口径），逐项带日期与来源",
        "有没有厂商或研究者公开提出过与 System One 对举的「系统 2」式路线说法，出处",
        "小模型/蒸馏路线在同一决策类任务上的公开对比数据（若有），注明来源与口径"
      ]
    },
    {
      "id": "what-it-cannot",
      "title": "它做不到的那几件事，恰好是刷屏文案里最不说的",
      "anchor": "限",
      "angle": "把局限逐条写实，且每条都指回官方文档或第三方实测：按字面读措辞而不是读意图；不擅长数数与算术；读日期、比颜色会错；Score 只能过阈值或排序、不能当量级；不会解释「为什么」；答案质量取决于你把选项列得多好——选项漏了，它就永远不会选到。最后一层是结构性风险：一个「格式上不会错」的接口，会把错误从「明显胡说」变成「看起来很有把握地选错」，而后者更难被下游发现。",
      "block_types": [
        "prose",
        "fact_strip",
        "note"
      ],
      "image_queries": [
        "AI 分类错误 案例 截图",
        "置信度 高 但错误 示意图",
        "工程师 调试 日志 屏幕"
      ],
      "fact_prompts": [
        "官方文档自己列出的限制与不适用场景，逐条引原文",
        "第三方实测中复现到的失败模式（字面理解、计数、日期比较等），给出处与测试描述",
        "「高置信度错判」在分类器文献里的讨论与检测方法，引论文或权威工程博客",
        "关于过度信任自动化建议（automation bias）的公开研究，给出处"
      ]
    },
    {
      "id": "check-list",
      "title": "自己验一遍的最小清单：拿你的题集，别拿它的成绩单",
      "anchor": "清",
      "angle": "给一份可执行的判断清单，读者今天就能跑：一，先造 200–500 条自己业务里带标注的题，覆盖边界与「选项里根本没有正确答案」的题；二，同时记录准确率、阈值—覆盖率曲线与校准度，不接受只看单点准确率；三，把「无答案」题单独统计——它会不会硬选一个；四，算每单总成本（推理费 + 重试 + 人审 + 错判代价）；五，留人审兜底与回滚开关；六，把评测集与结果存档，版本变了就重跑。每条都说明它防的是哪一种失败。",
      "block_types": [
        "steps",
        "keyvalue_table",
        "prose"
      ],
      "image_queries": [
        "标注 数据集 表格 界面",
        "A/B 测试 结果 仪表盘",
        "工程师 检查清单 白板"
      ],
      "fact_prompts": [
        "构建内部评测集与标注一致性的公开方法学（标注指南、一致性指标如 Cohen's kappa），引权威来源",
        "模型上线后持续评测/回归监控的公开工程实践（模型卡、监控指标、漂移检测），引来源",
        "把置信度阈值化为「弃权/转人工」的公开做法（selective prediction / abstention），引论文"
      ]
    },
    {
      "id": "what-changes-mind",
      "title": "接下来该盯什么：五个能证伪它的观察点",
      "anchor": "看",
      "angle": "不预测趋势，只把「如果……就说明……」写清楚，让读者自己等：一，是否出现带方法学的第三方复算（延迟、准确率、校准），只转述厂商数字的不算；二，是否有第二个团队发布同形态模型并公开架构与训练细节；三，是否有持牌机构公开披露把它用于实盘风控或合规闸门；四，官方是否给出可复现的评测协议与基线；五，生态里是否出现「因为接了它而把原本给人做的判断整段撤掉」的案例（那才是它真正改变流程的证据）。每一条同时给出「什么结果会推翻本篇的判断」。",
      "block_types": [
        "prose",
        "timeline",
        "note"
      ],
      "image_queries": [
        "论文 预印本 列表 页面",
        "监管 公告 文件 封面",
        "企业 财报 发布会 现场"
      ],
      "fact_prompts": [
        "截至发稿，上述五个观察点各自当前状态（有/无、日期、出处），逐条如实写",
        "同类「新架构方向」在历史上从发布到出现第三方复算通常间隔多久的公开案例，给出处",
        "任何关于 Jev 后续版本、定价、能力变更的官方公告，带日期"
      ]
    }
  ],
  "image_exclude_pages": [
    "https://blog.csdn.net/weixin_43440181/article/details/145887458"
  ]
}