{
  "topic": "咖啡",
  "category": "饮食风物",
  "tags": [
    "咖啡",
    "烘焙",
    "冲煮",
    "精品",
    "器具",
    "产区",
    "特调"
  ],
  "subtitle": "从一颗樱桃到一杯特调：咖啡的古往今来、产区、烘焙、机器与钱",
  "reader": "每天喝咖啡、但说不清自己喝的是什么的人",
  "theme": {
    "token": "coffee-roast",
    "hero_motif": "roast_axis",
    "hero_note": "开场用一条从浅焙到深焙的萃取色带，把'烘焙度'这个抽象概念变成一眼可读的视觉轴"
  },
  "reading_target_minutes": 10,
  "sections": [
    {
      "id": "history",
      "title": "咖啡史：从牧羊人的羊到全球第二大宗贸易品",
      "anchor": "史",
      "angle": "只讲改变格局的节点（埃塞起源传说、也门摩卡港、咖啡馆与启蒙运动、巴西崛起、越南罗布斯塔、精品第三波），不做年份流水账",
      "block_types": [
        "prose",
        "timeline",
        "fact_strip"
      ],
      "image_queries": [
        "咖啡 起源 埃塞俄比亚 咖啡樱桃",
        "也门 摩卡港 咖啡 历史",
        "17世纪 欧洲 咖啡馆 版画"
      ],
      "fact_prompts": [
        "咖啡最早有记录的栽培地是哪里、大约什么年代",
        "Bunna café / 咖啡馆传入威尼斯与巴黎的年份",
        "巴西何时成为全球最大咖啡生产国",
        "咖啡在全球大宗商品贸易中的排名依据是什么"
      ]
    },
    {
      "id": "species",
      "title": "两大豆种与品种谱系：阿拉比卡、罗布斯塔、以及那些稀有品种",
      "anchor": "种",
      "angle": "解释为什么阿拉比卡贵、罗布斯塔苦；把铁皮卡/波旁/瑰夏/SL28/Yirg 这些名字放回品种谱系里，而不是当成营销词",
      "block_types": [
        "prose",
        "keyvalue_table",
        "compare"
      ],
      "image_queries": [
        "阿拉比卡 咖啡树 叶片",
        "罗布斯塔 咖啡 果实",
        "瑰夏 咖啡 品种 花"
      ],
      "fact_prompts": [
        "阿拉比卡与罗布斯塔的咖啡因含量分别是多少",
        "瑰夏(Geisha)品种的起源产地与引入巴拿马的时间",
        "全球咖啡消费中阿拉比卡占比大约多少"
      ]
    },
    {
      "id": "origins",
      "title": "种植带：赤道两侧的国家、产区与风味地图",
      "anchor": "地",
      "angle": "按三大产区（非洲/中南美/亚太）讲风土如何写进味道，落到具体庄园级产区名，避免只说'哥伦比亚咖啡'",
      "block_types": [
        "prose",
        "card_grid",
        "keyvalue_table"
      ],
      "image_queries": [
        "哥伦比亚 咖啡庄园 山坡",
        "埃塞俄比亚 耶加雪菲 咖啡晾晒",
        "巴拿马 波奎特 咖啡园"
      ],
      "fact_prompts": [
        "咖啡种植带南北纬范围与海拔要求",
        "埃塞俄比亚、巴西、越南、哥伦比亚当前产量排名与数据年份",
        "耶加雪菲/希特拉/曼特宁/蓝山各自属于哪个国家哪个产区"
      ]
    },
    {
      "id": "processing",
      "title": "处理法：日晒、水洗、蜜处理与厌氧发酵",
      "anchor": "法",
      "angle": "讲清每种处理法在改变什么（糖转化、发酵风味、干净度），以及为什么'厌氧日晒'又贵又容易翻车",
      "block_types": [
        "prose",
        "steps",
        "compare"
      ],
      "image_queries": [
        "咖啡 日晒 晾晒床",
        "咖啡 水洗 处理站",
        "蜜处理 咖啡 黏液"
      ],
      "fact_prompts": [
        "日晒/水洗/蜜处理各自用水量与风味差异的技术解释",
        "厌氧发酵处理法是谁在什么年份引入咖啡的",
        "咖啡果实从采摘到干燥通常需要多少天"
      ]
    },
    {
      "id": "roasting",
      "title": "烘焙：一爆二爆、烘焙度与美拉德反应",
      "anchor": "焙",
      "angle": "把烘焙讲成可控的化学过程：升温曲线、一爆温度、发展时间；顺带破除'深色=浓'的常见误解",
      "block_types": [
        "prose",
        "steps",
        "timeline",
        "note"
      ],
      "image_queries": [
        "咖啡烘焙 滚筒烘焙机",
        "咖啡生豆 熟豆 颜色对比",
        "一爆 咖啡烘焙 色谱"
      ],
      "fact_prompts": [
        "一爆与二爆的大豆温区间",
        "浅焙与深焙的豆温与发展时间典型值",
        "咖啡烘焙中的美拉德反应与焦糖化分别在什么温度发生"
      ]
    },
    {
      "id": "brewing",
      "title": "冲煮：研磨、水温、粉水比与萃取率",
      "anchor": "冲",
      "angle": "给可复现的参数而不是情怀：不同器具的研磨度/水温/粉水比/时间一张表说清，并解释'金杯'萃取率区间",
      "block_types": [
        "prose",
        "price_table",
        "steps"
      ],
      "image_queries": [
        "手冲咖啡 V60 冲煮",
        "法压壶 咖啡 冲泡",
        "咖啡 折射仪 浓度测量"
      ],
      "fact_prompts": [
        "SCA 金杯理论的萃取率与浓度推荐区间是多少",
        "意式浓缩的典型粉液比与萃取时间",
        "不同器具推荐的研磨度与水温和粉水比"
      ]
    },
    {
      "id": "drinks",
      "title": "特调与奶咖图谱：从意式浓缩到dirty、生椰、橙C美式",
      "anchor": "调",
      "angle": "以浓缩为母液画一张'加什么变成什么'的谱系图，再讲近年中国市场的特调风潮与其商业逻辑",
      "block_types": [
        "prose",
        "card_grid",
        "steps",
        "keyvalue_table"
      ],
      "image_queries": [
        "拿铁 拉花 咖啡师",
        "dirty 咖啡 冰博克",
        "生椰拿铁 特调咖啡"
      ],
      "fact_prompts": [
        "flat white / latte / cappuccino 的奶量与奶泡厚度差异",
        "冰博克(Eispanner)做法原理与提纯方式",
        "生椰拿铁是哪一年由哪个品牌带火的"
      ]
    },
    {
      "id": "brands",
      "title": "品牌版图：连锁、精品烘焙商与它们的差别在哪",
      "anchor": "牌",
      "angle": "分三层讲：全球连锁、中国本土连锁、精品烘焙商；说明'精品'的判定依据是豆源+烘焙+杯测，不是装修",
      "block_types": [
        "prose",
        "card_grid",
        "compare"
      ],
      "image_queries": [
        "精品咖啡馆 烘焙 门店",
        "%Blue Bottle 咖啡 吧台",
        "中国 连锁咖啡 门店"
      ],
      "fact_prompts": [
        "Blue Bottle / Intelligentsia / Stumptown 成立时间与所在城市",
        "星巴克全球门店数量与最新财年数据",
        "瑞幸门店数量与近年增长数据",
        "中国精品烘焙代表品牌有哪些"
      ]
    },
    {
      "id": "competitions",
      "title": "大赛体系：WBC、冲煮/烘焙/拉花赛与冠军豆的效应",
      "anchor": "赛",
      "angle": "讲清世界咖啡赛事的组织结构与赛制，以及冠军为什么能带动一个产区价格（瑰夏拍卖价曲线）",
      "block_types": [
        "prose",
        "timeline",
        "fact_strip",
        "keyvalue_table"
      ],
      "image_queries": [
        "世界咖啡师大赛 WBC 比赛现场",
        "咖啡 拉花 比赛",
        "巴拿马 瑰夏 竞标 拍卖"
      ],
      "fact_prompts": [
        "World Barista Championship 始于哪一年、由谁主办",
        "WBC 赛制：裁判分为 taste/technical 的分数构成",
        "巴拿马 Best of Panama 瑰夏的最高每磅拍卖成交价与年份"
      ]
    },
    {
      "id": "grinders-machines",
      "title": "器具与咖啡机：从手摇磨到半自动、全自动与商用机",
      "anchor": "器",
      "angle": "按预算与用途给选购逻辑（磨比机重要、单锅炉 vs 双锅炉 vs 交换式），不堆型号",
      "block_types": [
        "prose",
        "card_grid",
        "price_table"
      ],
      "image_queries": [
        "咖啡机",
        "磨豆机",
        "意式咖啡机"
      ],
      "fact_prompts": [
        "家用意式机泵压标准 9bar 的由来",
        "圆锥刀与平刀磨豆机的差异",
        "典型入门/进阶/商用意式机的价格区间"
      ]
    },
    {
      "id": "prices",
      "title": "价格：从期货、生豆等级到一杯 30 元怎么来的",
      "anchor": "价",
      "angle": "拆解成本结构（豆子/奶/房租/人工占比），说明为什么精品豆贵、以及 C 期货与咖啡师收入的关系",
      "block_types": [
        "prose",
        "price_table",
        "keyvalue_table",
        "fact_strip"
      ],
      "image_queries": [
        "咖啡 期货 交易所 价格",
        "精品咖啡 生豆 分级",
        "咖啡馆 一杯 成本"
      ],
      "fact_prompts": [
        "阿拉比卡 C 期货近年价格区间",
        "SCA 生豆分级对瑕疵数的规定",
        "一杯 30 元拿铁的典型成本构成比例"
      ]
    },
    {
      "id": "tasting",
      "title": "杯测与风味：SCA 风味轮、杯测表与常见误区",
      "anchor": "味",
      "angle": "给一套能立刻上手的感官方法（干香湿香、酸质、body、余韵），并纠正'果酸=坏了''苦=好咖啡'等误解",
      "block_types": [
        "prose",
        "note",
        "compare",
        "steps"
      ],
      "image_queries": [
        "咖啡杯测 SCA 杯测桌",
        "咖啡 风味轮 SCA",
        "杯测 啜吸 咖啡师"
      ],
      "fact_prompts": [
        "SCA 杯测评分 80 分以上定义为精品咖啡的依据",
        "SCA 风味轮最早版本与最新修订年份",
        "标准杯测的粉水比与水温"
      ]
    }
  ],
  "slug": "coffee"
}
