{
  "topic": "开源权重与算力估值",
  "slug": "open-weight-valuation",
  "category": "AI算力",
  "tags": [
    "开源权重",
    "定制芯片",
    "推理成本",
    "估值阶梯",
    "可比公司",
    "客户集中度",
    "SEC",
    "口径陷阱",
    "可证伪条件",
    "Cerebras"
  ],
  "aliases": [
    "Cerebras",
    "Cerebras Systems",
    "CBRS",
    "WSE-3",
    "Wafer Scale Engine",
    "晶圆级引擎",
    "CS-3",
    "Cerebras Inference",
    "Qwen",
    "Qwen3.8",
    "Qwen3.8-27B",
    "通义千问",
    "阿里",
    "Alibaba",
    "G42",
    "Group 42",
    "MBZUAI",
    "OpenAI",
    "Groq",
    "SambaNova",
    "Together AI",
    "NVIDIA",
    "HBM",
    "SRAM",
    "tokens per second",
    "每秒词元",
    "424B4",
    "S-1",
    "10-Q",
    "SEC",
    "CFIUS",
    "MRA",
    "remaining performance obligation",
    "递延收入",
    "毛利率",
    "摊薄"
  ],
  "subtitle": "权重不要钱、芯片要十亿美元：把开源模型放上定制晶圆，能撞出什么样的估值。用一家已上市公司的 SEC 报表算一遍租金落在哪一层，再写下这套逻辑会在哪里断",
  "reader": "看过「开源模型 + 定制芯片 = 新估值」这类说法、想知道这句话里哪部分是算术哪部分是叙事的人；想学会怎么读一家刚上市公司的收入确认、摊薄与在手订单三个口径的人",
  "theme": {
    "token": "open-weight-collision",
    "hero_motif": "rent_shift",
    "hero_note": "母题是「钱从最上面那层搬到了最下面那层」：三条横带是价值链的三层，最上面那条只描边——开源权重这一层不收钱；中间那条是它现在的住处；最下面那条最宽，资本开支真正落在这一层。带子的宽窄表示谁拿走现金，不表示任何数量关系，图上不写数字（D-22）。"
  },
  "reading_target_minutes": 9,
  "image_exclude_pages": [
    "https://www.yiche.com",
    "https://auto.sina.com.cn",
    "https://www.pcauto.com.cn",
    "https://baike.so.com",
    "https://baike.baidu.com",
    "https://zhuanlan.zhihu.com",
    "https://www.xiaohongshu.com",
    "https://www.meituan.com",
    "https://www.dianping.com",
    "https://www.xiachufang.com",
    "https://www.haodou.com",
    "https://www.allrecipes.com",
    "https://www.yemek.com",
    "https://www.huaban.com",
    "https://haowallpaper.com",
    "https://www.smzdm.com",
    "https://guba.eastmoney.com",
    "https://xueqiu.com",
    "https://www.jw.org",
    "https://cookpad.com"
  ],
  "sections": [
    {
      "id": "open-weight-shift",
      "title": "用别人的开源模型卖自己的算力：租金从模型层搬到了哪一层",
      "anchor": "开源",
      "angle": "回答开发者真正问的那半个问题——开源权重会不会改变估值。要写成机制，不写成口号：①先把「模型层收租」这件事说清楚：闭源前沿模型的服务定价里，一部分是研发成本的摊销，客户为「只有你有」付费；②权重开源后，同一份权重可以被任意多家服务商托管，**模型本身不再是稀缺项**，于是竞争维度收敛到单价、吞吐、可用性、合规与上下文能力——这几项里只有前两项是芯片公司能直接改写的；③这带来的第一个好处是**内容成本骤降**：不用自己烧几亿美金训练前沿模型，就能上架「接近前沿」的模型；要写清代价：拿不到模型层的差异化，也就拿不到它的毛利；④第二个后果是**定价被同行拉平**：同一份开源权重在多家平台上跑，价格差只能由单位算力成本解释，于是估值问题变成「你的每百万 token 成本是不是结构性更低」；⑤要正面写这条逻辑的**反例条件**：如果开源模型的能力长期落后于闭源前沿，那么最愿意为速度付钱的客户仍然在买闭源模型，速度优势就落在低毛利的一侧——这一条要给出可查的支撑（例如各家平台上闭源与开源模型的定价差与用量口径），查不到就明确写未见数据；⑥最后给一个可核对的观察点：同一份权重在不同平台上的标价与标称吞吐，是可以自己列表的（本篇给方法与字段定义，具体数值以能点开的来源为准）。",
      "block_types": [
        "prose",
        "compare",
        "keyvalue_table",
        "note"
      ],
      "fact_prompts": [
        "同一份开源权重（含 Qwen3.8-27B）在多家推理平台上的标价与标称吞吐，逐项给可点开来源与取数日期",
        "Cerebras 平台上闭源模型与开源模型的定价差（官方价格页），给来源",
        "开源权重许可证对托管与商用的条款（模型页许可证原文），给来源",
        "是否有公开数据说明开源模型的用量份额变化（权威调查或平台披露），给来源；查不到写未见"
      ],
      "illustration_only": true,
      "image_queries": []
    },
    {
      "id": "valuation-ladder",
      "title": "估值阶梯：14.66 → 27.02 → 36.23 → 82.02 → 185.00，每一级是谁在什么前提下定的",
      "anchor": "估值",
      "angle": "开发者问「会撞出什么样的估值」，这一章把它换成**能核对的价格序列**，不给未来估值。要写清八点：①从招股书里把每一档价格与它的定价主体、前提一起列出：2024 年优先股 14.66/股、远期合同结算口径 27.02/股、要约收购 36.23/股、G42 认股权授予日公允价值 82.02/股、2026 年 5 月 IPO 定价 185.00/股——**每一档都要给原文**；②解释为什么同一公司的「每股价格」在不同工具上不可直接比较：优先股与普通股不同权、含清算优先与反稀释、远期合同是负债而非股权、认股权公允价值是估值模型的输出而非成交；③把 IPO 定价换算成市值需要发行后股本：给出 10-Q 的加权平均基本股数（Q2 2026 约 1.51 亿股）与完全稀释口径的差别，**并明确写「本篇只给算法，不给目标市值」**；④即时摊薄 155.49/股这句原文说明什么：发行价里有多少并不属于普通股东的账面权益，这是读 IPO 最容易被跳过的一行；⑤估值倍数的算术：用 IPO 价对应市值除以 2025 年 510.0M 收入、除以 2026 上半年年化收入，两种分母给出的倍数差多少——**同一句话换分母就换一个结论，这就是为什么「市销率多少倍」不能脱离期次**；⑥把「开源模型 + 定制芯片」这句叙事放回可核对的位置：它影响的是**未来收入的成本结构与可复制性**，不影响当期报表；因此任何估值讨论必须同时报出当期毛利率与集中度，否则等于只讲叙事；⑦明确禁止项：不给目标价、不给评级、不说「贵/便宜」、不说会涨会跌；⑧最后给一条读法：一级市场价格的抬升曲线，衡量的是**愿意承担流动性风险的资本**对该技术的判断变化，与二级市场定价条件不同，两者不可混用。",
      "block_types": [
        "prose",
        "keyvalue_table",
        "bar_chart",
        "note"
      ],
      "fact_prompts": [
        "424B4 中各档价格的原文与对应交易（优先股、远期合同、要约收购、认股权公允价值、IPO 定价），逐项给页次",
        "IPO 定价 185.00/股的发行规模、承销商、超额配售条款，给 424B4 与交割 8-K 来源",
        "即时摊薄 155.49/股的原文与计算口径，给来源",
        "发行后各类股本数量（Class A/B/N、期权、RSU、认股权）与完全稀释股数的披露，给来源",
        "上市后的股价区间与市值口径（可点开的行情来源，注明不是 SEC 数据），给来源与取数日期"
      ],
      "illustration_only": true,
      "image_queries": []
    },
    {
      "id": "comparables",
      "title": "可比与不可比：Groq、SambaNova、GPU 云，和那个绕不开的定价锚",
      "anchor": "可比",
      "angle": "回答「这套布局在行业里算什么位置」，写成**可比性判定**而不是排名。要写清七点：①先定义可比的三个必要条件：卖的是同一层（推理 API / 训练集群 / 整机销售）、同一类客户（超大买家 vs 长尾开发者）、同一类资本结构（自有芯片制造 vs 外购加速卡）；②按这三条逐个检查候选：Groq（同为低延迟推理、但 LPU 路线与商业模式不同）、SambaNova（系统+云混合）、Together/Fireworks（软件编排层、卡是租的）、以及 GPU 大厂云（既有芯片又有模型）；③说明为什么「每秒 tokens」这个指标不能跨公司直接比：模型不同、量化不同、上下文长度不同、是否含排队、是否限流，五项里任何一项不同就不可比；④把 NVIDIA 当作**定价锚**而非对手来描述：加速卡售价、租赁单价与软件生态如何决定所有芯片公司的毛利上限，这一段要有可查来源（官方定价页或权威行业价格调查）；⑤Cerebras 的差异化位置在**制造与封装**这一层（晶圆级方案需要独特的供应链），这一条要给出可查来源，并说明它同时是护城河候选与产能瓶颈候选；⑥写一条常见的错误类比：拿模型公司的估值倍数套到算力公司上（前者看能力与用户，后者看利用率与折旧），并说明为什么开源权重让这两种叙事更容易被混用；⑦不给任何投资建议，不做「谁能赢」的判断。",
      "block_types": [
        "compare",
        "keyvalue_table",
        "prose",
        "note"
      ],
      "fact_prompts": [
        "Groq、SambaNova、Together、Fireworks 各自官方标称的推理速度与定价口径（同一模型的 tokens/s 与每百万 token 价格），逐项给来源与取数日期",
        "NVIDIA 加速卡的公开定价或租赁市场价（官方页面或权威行业调查），给来源",
        "各家的商业模式披露（卖卡、卖系统、卖 API 的收入结构），给来源",
        "晶圆级方案在制造与封装上的公开技术说明（供应链、代工、测试），给来源",
        "是否存在权威研究比较不同推理平台的能耗与单位成本，给来源；查不到写未见"
      ],
      "illustration_only": true,
      "image_queries": []
    },
    {
      "id": "what-breaks",
      "title": "这套逻辑会在哪里断：三种失效方式，各自先出现什么征兆",
      "anchor": "失效",
      "angle": "把「风险」写成**可观测的失效路径**，而不是清单式套话。要写清六点：①失效一：速度不再稀缺——当 GPU 侧通过推理栈优化（投机解码、批处理、量化、专用内核）把单流速度追平，硬件溢价失去支撑；征兆是可查的：同一模型在多家平台的标称吞吐差收敛；②失效二：开源权重变成商品——同一权重人人可托管，价格战把毛利压到接近电力与折旧成本；征兆是标价与毛利率同向下滑，且合同负债增速转负；③失效三：客户结构反噬——集中度以「一家换成另一家」的形式延续，任何单一买家（主权客户或超大实验室）改变采购节奏就造成季度剧震；招股书自己就写了这条风险，给原文；④每条失效路径配一个**证伪它的观测条件**（不是预测），例如「若毛利率连续两季回升且客户数增长，则失效二未被证实」；⑤明确写本篇不做概率判断、不给方向；⑥最后一段把三章串起来：单位成本（第 7 章）、可比性（第 8 章）、资本开支（第 9 章）共同决定这套叙事能否兑现，任何一环缺失，估值就只是叙事。",
      "block_types": [
        "prose",
        "keyvalue_table",
        "note"
      ],
      "fact_prompts": [
        "招股书风险因素章节中与上述三条直接相关的原文（客户集中、竞争与价格、技术追赶），给页次",
        "GPU 侧推理优化把单流吞吐提升的公开基准或厂商披露，给来源",
        "同一模型在不同平台标称吞吐差距是否收敛的可查数据（多次取数记录），给来源与日期",
        "行业里开源模型服务价格的历史变化（可点开的价格存档），给来源"
      ],
      "illustration_only": true,
      "image_queries": []
    },
    {
      "id": "how-to-read",
      "title": "读这类公司的八个口径陷阱：把方法留下，把结论留给读者",
      "anchor": "方法",
      "angle": "收口章要交付**可复用的方法**，而不是总结观点。写清八个陷阱：①把「年化」当「现状」——用 H1×2 外推一家季度环比下降的公司会系统性高估；②把标称吞吐当实测——三种口径（单流、聚合、含首 token）常被混用；③把一次性收益当盈利能力——认股权与远期合同重估可以造成一年净利为正、次年巨亏；④把合同容量当合同金额——GW 与美元之间隔着电价、利用率与 pass-through；⑤把客户数当客户独立性——同一生态的两个主体仍是两个集中度；⑥把市销率当可比倍数——硬件一次性收入与算力订阅收入不该共用一个倍数；⑦把一级市场估值抬升当二级市场定价——流动性条件完全不同；⑧把开源模型的能力上限当自家能力——服务商的护城河不写在模型的跑分里。每个陷阱配一句「在本篇哪一章能看到它的实例」，让方法落回证据。最后写：本篇给的是口径与算术，不是结论；所有数字都带来源与期次，读者应当自己去核最新一期。",
      "block_types": [
        "steps",
        "note",
        "keyvalue_table"
      ],
      "fact_prompts": [
        "复核本篇所有关键数字的原始出处清单（每条对应哪一期 SEC 文件或哪个官方页面），逐项给来源",
        "官方是否提供可下载的定价与吞吐数据接口，给来源",
        "最新一期 10-Q 的报告日与 filing 日期（用于说明本篇数据的时点边界），给来源"
      ],
      "illustration_only": true,
      "image_queries": []
    },
    {
      "id": "falsify",
      "title": "可证伪的观察条件：出现什么，「开源权重 + 定制芯片」这套逻辑才算被支持",
      "anchor": "观察",
      "angle": "把全篇换成一张**观察表**，格式统一为「观测项 / 数据源 / 本篇里量到的现值 / 支持哪条推理 / 反驳哪条推理」。要写清七点：①观测项必须全部是公开可查的：毛利率与分部收入（每季 10-Q）、合同负债与 RPO（附注）、客户集中度（附注）、现金与资本开支（现金流量表）、同一模型在各平台的标价与标称吞吐（各家价格页，取数要带日期）、已投运容量（官方公告）；②每一项都要写清**现值是多少、来自哪一期**，不许写「持续跟踪」这类无法勾验的话；③为「速度溢价会被追平」这条给出可核对的收敛判据（吞吐差与标价差的同期变化）；④为「开源权重会摊薄模型层租金」给出判据（同一权重托管商数量与价格离散度）；⑤为「集中度风险未消」给出判据（最大客户占比与应收占比是否同步下降）；⑥明确重复本篇不做的四件事：不预测股价、不给目标价、不给买卖建议、不评价任何国家政策；⑦最后写一条时效声明：所有数字都有取数日期，财务数据的最新期次是 2026-06-30（10-Q），行情与价格类数据的日期各自标注，读者看到的可能已经更新。",
      "block_types": [
        "keyvalue_table",
        "steps",
        "note"
      ],
      "fact_prompts": [
        "复核每个观测项的官方数据源地址与最新一期取值，逐项给来源与取数日期",
        "确认本篇最新可用的财务期次（10-Q 报告日）与下一份定期报告的披露时点，给 SEC 来源",
        "各推理平台价格页的取数日期与标价（含同一模型的多家报价），逐项给来源"
      ],
      "illustration_only": true,
      "image_queries": []
    }
  ]
}
