{
  "topic": "AI眼镜",
  "category": "人工智能",
  "tags": [
    "AI眼镜",
    "智能眼镜",
    "AR眼镜",
    "光波导",
    "供应链",
    "A股"
  ],
  "aliases": [
    "AI眼镜",
    "智能眼镜",
    "AR眼镜",
    "雷鸟",
    "RayNeo",
    "Rokid",
    "XREAL",
    "Nreal",
    "Meta",
    "Ray-Ban",
    "小米",
    "Even Realities",
    "星纪魅族",
    "MYVU",
    "Halliday",
    "Vuzix",
    "影目",
    "INMO",
    "李未可",
    "夸克",
    "恒玄",
    "BES2700",
    "BES2800",
    "高通",
    "Qualcomm",
    "AR1",
    "展锐",
    "JBD",
    "光舟",
    "视涯",
    "歌尔",
    "立讯",
    "博士眼镜",
    "明月镜片",
    "康耐特",
    "水晶光电",
    "蓝思"
  ],
  "subtitle": "从音频眼镜到全彩光波导：多芯架构、200mAh 电池、镜框里的供应链，以及 A股与美股各自卡在哪一环",
  "reader": "看过发布会参数表但分不清「有屏」和「有 AR」差多远的人，想知道该等哪一代、该看哪家公司的报表",
  "theme": {
    "token": "glasses-waveguide",
    "hero_motif": "waveguide_rainbow",
    "hero_note": "以光波导的耦出栅为母题：光在几毫米厚的玻璃里靠全反射前传，每过一段栅就漏出一丝，越靠近出瞳越亮，最后三格才出射成蓝紫——这是全彩画面真正离开镜片的位置。"
  },
  "reading_target_minutes": 12,
  "sections": [
    {
      "id": "what-it-is",
      "title": "先分清三件事：戴得住、有画面、能算 AI",
      "anchor": "分",
      "angle": "市场上所有争论都来自把这三件事混为一谈：音频眼镜（摄像头+麦克风+扬声器，没有屏）、提示型 HUD（单绿色小字，只看通知）、全彩 AR（能在真实世界上叠画面）。这一章只给判据，不给结论：每类各举一款在售代表，说清它们的目标用户为什么完全不同，以及为什么重量、续航、价格三条线同时被这三类拉开。",
      "block_types": [
        "prose",
        "keyvalue_table",
        "note"
      ],
      "image_queries": [
        "小米AI眼镜 发布 现场",
        "Meta Ray-Ban Display 眼镜",
        "雷鸟 X3 Pro 眼镜 佩戴"
      ],
      "fact_prompts": [
        "小米 AI 眼镜的发布时间、重量、电池容量、标称续航与售价，来源给官方页或发布会报道",
        "Meta Ray-Ban Display 的发布时间、售价、显示方式与目标市场，来源给官方新闻室或主流科技媒体",
        "雷鸟 X3 Pro 的发布时间、售价、光机与波导方案，来源给官方规格页",
        "三款产品的重量与续航数字必须逐条给来源，不许用『大约』糊过去"
      ]
    },
    {
      "id": "audio-first",
      "title": "无显示派：把眼镜当耳机卖，为什么它先跑量",
      "anchor": "量",
      "angle": "这一类的全部价值是「不用多带一个设备」：第一视角拍摄、通话、语音助手。它不需要光机，所以能压到接近普通眼镜的重量与价格，也因此成为出货量最大的一类。讲清它牺牲了什么（没有任何视觉输出，AI 只能靠耳朵和播报），以及为什么退货率高——把「眼镜」和「相机」两个身份硬叠在一起会撞上隐私与社交接受度。",
      "block_types": [
        "prose",
        "fact_strip",
        "price_table",
        "note"
      ],
      "image_queries": [
        "小米AI眼镜 镜腿 摄像头",
        "Ray-Ban Meta 眼镜 街拍",
        "AI眼镜 拍摄 指示灯"
      ],
      "fact_prompts": [
        "无显示类 AI 眼镜的出货量或销量数据（机构口径、年份、来源）",
        "小米 AI 眼镜退货率的公开报道数字与口径（哪家媒体、什么统计范围）",
        "摄像头录制指示灯/隐私提示的法规或行业要求，给来源",
        "该类产品的价格带（最低、主流、最高），逐条给来源"
      ]
    },
    {
      "id": "waveguide",
      "title": "光波导派：把整块镜片变成屏幕",
      "anchor": "导",
      "angle": "波导是唯一能把光学元件藏进镜片轮廓、让眼镜看起来像眼镜的路线。讲清一条光路怎么走：MicroLED 或 LCoS 光机把图像耦进玻璃/树脂基底，靠全反射传到眼前，再由耦出光栅展开成画面。代价也逐项摆开：亮度、彩虹纹、正面漏光（别人看得见你的画面）、单色与全彩的良率差、以及为什么它贵到万元级。",
      "block_types": [
        "prose",
        "steps",
        "bar_chart",
        "note"
      ],
      "image_queries": [
        "光波导 镜片 特写",
        "雷鸟 X3 Pro 全彩 衍射光波导",
        "Rokid Glasses 眼镜 正面"
      ],
      "fact_prompts": [
        "雷鸟 X3 Pro 的入射光机类型、峰值亮度（nits）、FOV、分辨率，逐条给来源",
        "Rokid Glasses 的光学方案、亮度、重量与售价，给来源",
        "衍射光波导与阵列光波导（反射式）在良率与成本上的公开对比数据",
        "波导镜片的正面漏光/彩虹纹问题的厂商自述或第三方评测来源"
      ]
    },
    {
      "id": "birdbath",
      "title": "BirdBath 与自由曲面：最亮最便宜，却最厚",
      "anchor": "浴",
      "angle": "观影镜走的是另一条物理路线：偏振分光、曲面镜反射、光路在镜片里折一次，所以能做到很高的入眼亮度和极低成本，代价是镜片厚度、外观像墨镜、以及无法做成日常眼镜。这一章解释为什么「画质最好、最便宜」的一类反而不是终局答案——它解决的是「随身大屏」，不是「全天候佩戴」。",
      "block_types": [
        "prose",
        "compare",
        "keyvalue_table"
      ],
      "image_queries": [
        "XREAL One Pro 眼镜",
        "雷鸟 Air 3 观影 眼镜",
        "BirdBath 光学 结构 拆解"
      ],
      "fact_prompts": [
        "XREAL One / 雷鸟 Air 系列的亮度（nits）、FOV、分辨率、重量与价格，逐条给来源",
        "BirdBath 光学的厚度与透光率公开数据或拆解来源",
        "观影镜与波导镜的出货量对比（机构口径与年份）"
      ]
    },
    {
      "id": "optics-engine",
      "title": "光机之争：MicroOLED、MicroLED、LCoS 与扫描激光",
      "anchor": "机",
      "angle": "同样叫「全彩」，四条发光路线的难点完全不同：MicroOLED 亮度受限于有机材料、要红绿蓝叠片或色转换；MicroLED 效率最高但巨量转移与红光效率是公开难题；LCoS 便宜成熟但体积与偏振损失大；扫描激光体积小亮度高但散斑与安全性是硬约束。这一章按「亮度上限—体积—成本—全彩难度」四轴把它们排开，并说明为什么波导路线几乎被绑死在 MicroLED 上。",
      "block_types": [
        "prose",
        "bar_chart",
        "compare",
        "note"
      ],
      "image_queries": [
        "JBD MicroLED 光引擎",
        "MicroOLED 微显示 芯片",
        "光波导 光机 模块 特写"
      ],
      "fact_prompts": [
        "JBD（上海显耀）公开的光引擎型号、亮度、体积与单色/全彩方案，给来源",
        "MicroOLED 与 MicroLED 在入眼亮度上的公开数字对比，逐条给来源",
        "LCoS 光机的体积与亮度典型值，给来源",
        "扫描激光方案在消费眼镜上的公开难点（散斑、人眼安全等级），给来源"
      ]
    },
    {
      "id": "soc",
      "title": "芯片：为什么是「多芯」而不是一颗 SoC",
      "anchor": "芯",
      "angle": "眼镜的功耗预算撑不起一颗手机级 SoC 常开，所以主流做法是分工：低功耗协处理器管唤醒、音频与传感器，应用处理器管影像与 AI，另一颗专门跑显示或通信。讲清这套架构怎么被电池逼出来、各家选了谁（高通 AR1/W5 系、恒玄 BES 系、紫光展锐等），以及为什么「本地大模型」和「云端大模型」的分界会直接改写芯片选型。",
      "block_types": [
        "prose",
        "keyvalue_table",
        "fact_strip"
      ],
      "image_queries": [
        "高通 AR1 芯片 发布",
        "恒玄科技 BES2800 芯片",
        "AI眼镜 主板 拆解 芯片"
      ],
      "fact_prompts": [
        "小米 AI 眼镜采用的芯片方案（型号、厂商），给来源",
        "Meta Ray-Ban 系列采用的芯片平台与制程节点，给来源",
        "恒玄科技公开的智能穿戴/AI眼镜芯片型号与已导入的品牌，给来源",
        "端侧运行模型的能力边界（参数量、内存），给公开技术来源，不许自创判断"
      ]
    },
    {
      "id": "battery",
      "title": "电池与续航：镜腿里那 200mAh 怎么分",
      "anchor": "电",
      "angle": "所有参数里最诚实的是电池。镜腿截面决定了容量上限，于是续航变成一道分配题：待机、拍摄、显示各占多少；为什么混合续航口径满天飞；充电盒为什么成了标配；以及为什么一开全彩显示，标称数字就掉一个量级。这一章把各家标称值并列，并明确区分「综合使用」与「连续拍摄/连续显示」两种口径。",
      "block_types": [
        "prose",
        "bar_chart",
        "price_table",
        "note"
      ],
      "image_queries": [
        "AI眼镜 镜腿 电池 拆解",
        "AI眼镜 充电盒",
        "小米AI眼镜 电池 容量"
      ],
      "fact_prompts": [
        "至少四款在售 AI 眼镜的电池容量（mAh）与官方标称续航，逐条给来源并标出口径",
        "连续拍摄/连续显示场景下的实测续航数据（第三方评测来源）",
        "充电盒补能次数或总续航的官方数字，给来源"
      ]
    },
    {
      "id": "frame-lens",
      "title": "镜框与镜片：重量分布、电致变色与近视一体化",
      "anchor": "框",
      "angle": "眼镜最终是戴在脸上的工业品：TR90、板材、钛合金的取舍决定重量与可维修性；前重后轻会让鼻梁受力集中；电致变色镜片解决「室内透明、室外墨镜」但要额外功耗；近视用户必须定制配镜，这直接把光学件与渠道绑在一起。这一章解释为什么眼镜渠道商在这波里突然变得重要。",
      "block_types": [
        "prose",
        "keyvalue_table",
        "card_grid"
      ],
      "image_queries": [
        "AI眼镜 镜框 钛合金",
        "电致变色 镜片 眼镜",
        "博士眼镜 门店 AI眼镜"
      ],
      "fact_prompts": [
        "主流 AI 眼镜的镜框材料（型号级），给官方来源",
        "电致变色镜片的切换时间与功耗公开数据，给来源",
        "近视定制配镜在 AI 眼镜售出的占比或渠道说法，给来源"
      ]
    },
    {
      "id": "supply-chain",
      "title": "供应链地图：A股、港股、美股各自卡在哪一环",
      "anchor": "链",
      "angle": "按 BOM 从上到下点名：整机 ODM/代工、SoC、光机与微显示、波导片、镜片与镜框、电池、声学、渠道。每一环给出上市公司与代码，并明确区分「已批量供货」与「互动平台表态」两种证据强度——这是本领域最容易掺水的一章，凡是没有公开订单来源的说法一律不写。",
      "block_types": [
        "prose",
        "keyvalue_table",
        "bar_chart",
        "note"
      ],
      "image_queries": [
        "歌尔股份 智能眼镜 代工 车间",
        "水晶光电 光波导 片",
        "明月镜片 镜片 工厂"
      ],
      "fact_prompts": [
        "AI 眼镜整机代工/ODM 的上市公司名单与已确认供货的品牌，逐条给来源",
        "光波导片、光机、镜片、电池、声学各环节的 A股/港股公司（含代码），逐条给来源",
        "美股一侧的供应商（芯片、终端品牌、光学），给来源",
        "凡只在投资者互动平台表态、没有订单或财报佐证的关系，必须标注为「表态」或干脆不写"
      ]
    },
    {
      "id": "route-compare",
      "title": "技术路线差异对照：一张表看懂该等哪一代",
      "anchor": "比",
      "angle": "把前面拆开的维度并成一张对照：光学路线 × 显示路线 × 芯片方案 × 续航 × 重量 × 价格 × 适用场景。给出判断依据而不是结论：什么需求下无显示派就够了、什么需求必须等全彩波导降本、什么需求现在买观影镜最划算。所有对比项都要能回指前面章节的来源。",
      "block_types": [
        "prose",
        "compare",
        "keyvalue_table",
        "bar_chart"
      ],
      "image_queries": [
        "AI眼镜 对比 三款",
        "光波导 眼镜 侧面 特写",
        "智能眼镜 参数 表"
      ],
      "fact_prompts": [
        "同一口径下三类产品的价格带对比（最低/主流/最高），逐条给来源",
        "三类产品的典型重量区间，给来源",
        "全彩波导方案的成本下降趋势（厂商或机构说法），给来源；没有就不写"
      ]
    },
    {
      "id": "limits",
      "title": "边界：隐私、生态，以及为什么它还没替代耳机和手机",
      "anchor": "限",
      "angle": "把风险写实：第一视角拍摄的社交接受度与法律边界、语音助手误唤醒、配镜售后链条太长、App 生态几乎为零、以及厂商自测参数与第三方实测的落差。这一章不预测销量，只列出「什么时候这条产品会成立」的可验证条件。",
      "block_types": [
        "prose",
        "quote",
        "timeline",
        "note"
      ],
      "image_queries": [
        "AI眼镜 隐私 指示灯 争议",
        "智能眼镜 法规 新闻",
        "AI眼镜 售后 配镜"
      ],
      "fact_prompts": [
        "因佩戴 AI 眼镜拍摄引发的公开争议或诉讼案例，给来源与时间",
        "任一国家/地区对可穿戴摄像头设备的明确法规要求，给来源",
        "厂商自测与第三方实测差距的具体例子（型号、数字、两家来源）"
      ]
    }
  ],
  "slug": "ai-glasses"
}